{
  "schemaVersion": 1,
  "contractVersion": "1.0.0",
  "workItemId": "P04-01",
  "phase": "P04",
  "risk": "R0",
  "status": "contract-frozen-with-unresolved-gaps",
  "featureIds": [],
  "capturedAt": "2026-08-17T23:30:36Z",
  "referenceBaseline": "37cb850c149168bbfff5a98768067a1a63bff2f9",
  "scope": {
    "mode": "reference-only",
    "implementationOwnership": "none",
    "databaseChanges": false,
    "businessTables": false,
    "productionRoutes": false,
    "workers": false,
    "signerRuntime": false,
    "kmsAccess": false,
    "productionSecrets": false,
    "privateKeyDecryptions": 0,
    "transactionSignatures": 0,
    "transactionBroadcasts": 0,
    "externalRpcCalls": 0
  },
  "checksumScope": {
    "algorithm": "SHA-256",
    "excludedSelfReferentialFiles": [
      "artifact-manifest.json",
      "sha256sums.txt"
    ],
    "priorAcceptance": "all baseline P00-P03-04 acceptance files"
  },
  "files": [
    {
      "path": "api-contracts.json",
      "bytes": 28200,
      "sha256": "0bdf882fc185a0d298350f47440e634a923714d56872b458413a4e11083490c4",
      "mediaType": "application/json",
      "category": "contract"
    },
    {
      "path": "checks/artifact-schema.txt",
      "bytes": 304,
      "sha256": "efa24b125cff7246c8b111f9a896cee28913387f54365ff03cce2424901b7a6b",
      "mediaType": "text/plain",
      "category": "check"
    },
    {
      "path": "checks/governance-test.txt",
      "bytes": 308,
      "sha256": "5196a829762ad1e63c88d9746a558f3e2d95247bd528ef51157f8fea9578b406",
      "mediaType": "text/plain",
      "category": "check"
    },
    {
      "path": "checks/initial-failure.txt",
      "bytes": 621,
      "sha256": "3efadec6cd49689cd8759e4f20932e2b1be74be7d86ec2eb74366df02064ed7a",
      "mediaType": "text/plain",
      "category": "check"
    },
    {
      "path": "checks/prior-acceptance-integrity.txt",
      "bytes": 344,
      "sha256": "bb1da8a38cd3145c47feef6ef503a685d482f9a726b7aba6950e8d6a9f571856",
      "mediaType": "text/plain",
      "category": "check"
    },
    {
      "path": "checks/quality-gates.txt",
      "bytes": 235,
      "sha256": "763120147f340264b39c151fc8119561ce57f646a0ae94583600f7d3bd335544",
      "mediaType": "text/plain",
      "category": "check"
    },
    {
      "path": "checks/security-audit.txt",
      "bytes": 339,
      "sha256": "64ae389e1fb9cb60b86c2f89a9a2c1312659b1d1859c6dad8d3c2beaf52886cc",
      "mediaType": "text/plain",
      "category": "check"
    },
    {
      "path": "coverage.json",
      "bytes": 4019,
      "sha256": "7ead016c298a80584aae7b9096958b3b432fbc48b65dfa917e1d125d939e97aa",
      "mediaType": "application/json",
      "category": "catalog"
    },
    {
      "path": "fact-catalog.json",
      "bytes": 8470,
      "sha256": "8d47cc35dccc790a84fe12552c240a1537c64ac81d123f00aeb5abad6885c85e",
      "mediaType": "application/json",
      "category": "catalog"
    },
    {
      "path": "fixture-index.json",
      "bytes": 2151,
      "sha256": "e6b42561bd8e0af32250ebbe9df40a0a46c4bb2055ba486b66824b2c4a89986b",
      "mediaType": "application/json",
      "category": "catalog"
    },
    {
      "path": "fixtures/aad-tamper.json",
      "bytes": 1746,
      "sha256": "f82bfaa8ad1794c4db81a950b05185448d2af529b2f393598b94be10580b59c6",
      "mediaType": "application/json",
      "category": "fixture"
    },
    {
      "path": "fixtures/argon2id-known-answer.json",
      "bytes": 1040,
      "sha256": "55c8d003c223637e85427b52675e5becc17a9ef3a99e2d3b43c520c0a62846a4",
      "mediaType": "application/json",
      "category": "fixture"
    },
    {
      "path": "fixtures/crypto-known-answer.json",
      "bytes": 1363,
      "sha256": "eaf7093fb9aacaa98617759291936f18c5469d327ea42efdedb84563f08f2b56",
      "mediaType": "application/json",
      "category": "fixture"
    },
    {
      "path": "fixtures/lifecycle-recovery.json",
      "bytes": 3974,
      "sha256": "71142b87b829d231b70992da3173473b43c36f4ba6613ce7fa7e44857e3036ab",
      "mediaType": "application/json",
      "category": "fixture"
    },
    {
      "path": "fixtures/nonce-concurrency.json",
      "bytes": 2268,
      "sha256": "9737299dae96463aad5f34545e8caa32b88fa57acd70016988ed83bfbf1b5cbd",
      "mediaType": "application/json",
      "category": "fixture"
    },
    {
      "path": "fixtures/replacement-lineage.json",
      "bytes": 2420,
      "sha256": "1e3820e5858b544216987eadac11d280d70476c488435c3f4bf23816f6385c00",
      "mediaType": "application/json",
      "category": "fixture"
    },
    {
      "path": "gaps.json",
      "bytes": 5451,
      "sha256": "bdc1558a633f2c19652c154c56b7e17835a73f66559d501f31c49f8c3e1737b9",
      "mediaType": "application/json",
      "category": "catalog"
    },
    {
      "path": "key-lifecycle-contracts.json",
      "bytes": 10138,
      "sha256": "50bb46f6fa1a024e258d2bd76fca092a382f73330fe7abc44bc560bc26aef93a",
      "mediaType": "application/json",
      "category": "contract"
    },
    {
      "path": "prior-acceptance-sha256s.txt",
      "bytes": 53114,
      "sha256": "d51485c12cc849863b3f01ac9f3e4cfca5a9ba7f315fcb5517181e6bded833a7",
      "mediaType": "text/plain",
      "category": "integrity"
    },
    {
      "path": "security-boundary-contracts.json",
      "bytes": 5339,
      "sha256": "863a67fab93b8f8bb4fdd7e713a5ef43e1a862f04f3e787aba9ff88877d6b6f9",
      "mediaType": "application/json",
      "category": "contract"
    },
    {
      "path": "settings-contracts.json",
      "bytes": 8563,
      "sha256": "58b9c2d4d9906aad84e8f6548dab970e63db80428385284ca8b2761a10b789b2",
      "mediaType": "application/json",
      "category": "contract"
    },
    {
      "path": "transaction-contracts.json",
      "bytes": 10092,
      "sha256": "ddeb631cb699f850053713351fabc9c91a27c3406bf13db580cf418abb48b83b",
      "mediaType": "application/json",
      "category": "contract"
    },
    {
      "path": "ui-state-contracts.json",
      "bytes": 6933,
      "sha256": "62a1e5f4f5fe856e31e80ff208d1d7d88cf14e63c7f1e5dd4d57edff4ef1135e",
      "mediaType": "application/json",
      "category": "contract"
    }
  ],
  "references": [
    {
      "path": "artifacts/acceptance/P01-04/E-RBAC.md",
      "commit": "37cb850c149168bbfff5a98768067a1a63bff2f9",
      "bytes": 2064,
      "sha256": "728bef9cff03ef53d612e3fa2b53401db109f8725046b1a150e1d88ebc9e74d8",
      "source": "Locally verified separation between authentication wallets and signer or transaction authority",
      "classification": "LOCAL-DECISION"
    },
    {
      "path": "artifacts/lpbot/2026-08-13/api-calls.json",
      "commit": "37cb850c149168bbfff5a98768067a1a63bff2f9",
      "bytes": 238813,
      "sha256": "7c44ce0b952258172cbcb07b65c862931b3556b906dbd8e23f9fee905382915b",
      "source": "Static bundle candidates for wallet, keystore, transfer, security password, RPC, and OKX client calls",
      "classification": "BUNDLE-CANDIDATE"
    },
    {
      "path": "docs/ARCHITECTURE_AND_WORKFLOWS.md",
      "commit": "37cb850c149168bbfff5a98768067a1a63bff2f9",
      "bytes": 26582,
      "sha256": "6651bd727acf87d7bbfb5f5db7faaefe7914d5e626fb857eb16e076db26b9bc8",
      "source": "Inferred isolated signer, envelope encryption, operation, nonce, and reconciliation boundaries",
      "classification": "INFERRED"
    },
    {
      "path": "docs/DEVELOPMENT_ROADMAP.md",
      "commit": "37cb850c149168bbfff5a98768067a1a63bff2f9",
      "bytes": 22522,
      "sha256": "7787287de92625f9aa46a67d0ded0cd60d549f6d87fe1a862c6de1024c8a42e7",
      "source": "P04 scope, tests, completion definition, and security gate",
      "classification": "LOCAL-DECISION"
    },
    {
      "path": "docs/FUNCTION_MATRIX.md",
      "commit": "37cb850c149168bbfff5a98768067a1a63bff2f9",
      "bytes": 31468,
      "sha256": "eafeec9dd0e9c7cc9532f6870786a0b2c8071399ee86608156aa71e3edc2b72e",
      "source": "WALLET-01..10 and SET-06..07 public, bundle, and inferred feature definitions",
      "classification": "PUBLIC"
    },
    {
      "path": "docs/TRACEABILITY_MATRIX.md",
      "commit": "37cb850c149168bbfff5a98768067a1a63bff2f9",
      "bytes": 47134,
      "sha256": "1839c06722467aea231cab6d2b55a5a508433a464d0b787a70a1010881f51574",
      "source": "P04 feature-to-test and evidence mapping",
      "classification": "PUBLIC"
    },
    {
      "path": "docs/VIBE_CODING_PLAYBOOK.md",
      "commit": "37cb850c149168bbfff5a98768067a1a63bff2f9",
      "bytes": 25185,
      "sha256": "4ac17ea1807a87fed73a4dd1e68313dc1f44801f83f603b5d6bce063a8b85b2a",
      "source": "P04 fixture-first signer and crypto failure-test execution guidance",
      "classification": "LOCAL-DECISION"
    },
    {
      "path": "infra/migrations/20260814000300_create_login_wallet_auth.sql",
      "commit": "37cb850c149168bbfff5a98768067a1a63bff2f9",
      "bytes": 3147,
      "sha256": "7c15b318eb3ce0fc2e0c675b4b906e77f686513f800a8cb02ee736400d8ddc32",
      "source": "Authoritative local table comments freezing auth_login_wallets as authentication-only",
      "classification": "LOCAL-DECISION"
    }
  ],
  "checks": [
    {
      "id": "initial-red",
      "result": "expected-failure",
      "evidencePath": "checks/initial-failure.txt"
    },
    {
      "id": "governance-test",
      "result": "passed",
      "evidencePath": "checks/governance-test.txt"
    },
    {
      "id": "artifact-schema",
      "result": "passed",
      "evidencePath": "checks/artifact-schema.txt"
    },
    {
      "id": "prior-acceptance-integrity",
      "result": "passed",
      "evidencePath": "checks/prior-acceptance-integrity.txt"
    },
    {
      "id": "quality-gates",
      "result": "passed",
      "evidencePath": "checks/quality-gates.txt"
    },
    {
      "id": "secret-scan",
      "result": "passed",
      "evidencePath": "checks/security-audit.txt"
    },
    {
      "id": "dependency-audit",
      "result": "passed",
      "evidencePath": "checks/security-audit.txt"
    }
  ],